{
  "$schema": "http://json-schema.org/draft-07/schema#",
  "$id": "https://rightkit.dev/schemas/rightgit-manifest-v1.json",
  "title": "right-git per-repo manifest (.rightgit.json)",
  "description": "Declares which right-git lanes a public repo installs and how templates should be parameterized. Hand-validated by manifest.mjs — this file documents the contract, it is not fed to a JSON Schema validator at runtime.",
  "type": "object",
  "required": ["schemaVersion", "compile", "lanes", "matrix", "packageManager", "templateVersion"],
  "additionalProperties": false,
  "properties": {
    "schemaVersion": {
      "const": 1
    },
    "compile": {
      "const": "github-actions-only"
    },
    "lanes": {
      "type": "array",
      "minItems": 1,
      "items": {
        "enum": [
          "ci",
          "swift-check",
          "qualification",
          "package-smoke",
          "release-candidate",
          "publish-npm",
          "publish-package-managers",
          "regenerate",
          "sign-existing"
        ]
      }
    },
    "matrix": {
      "type": "object",
      "required": ["os", "node"],
      "additionalProperties": false,
      "properties": {
        "os": {
          "type": "array",
          "minItems": 1,
          "items": { "type": "string", "minLength": 1 }
        },
        "node": {
          "type": "array",
          "minItems": 1,
          "items": { "type": "string", "minLength": 1 }
        }
      }
    },
    "packageManager": {
      "type": "string",
      "pattern": "^(pnpm|npm|yarn)@\\d+\\.\\d+\\.\\d+$"
    },
    "publish": {
      "type": "object",
      "additionalProperties": false,
      "properties": {
        "npm": {
          "type": "object",
          "required": ["oidc", "provenance"],
          "additionalProperties": false,
          "properties": {
            "oidc": { "type": "boolean", "const": true },
            "provenance": { "type": "boolean" }
          }
        },
        "homebrew": {
          "type": "object",
          "required": ["tap", "formulaName"],
          "additionalProperties": false,
          "properties": {
            "tap": { "type": "string", "pattern": "^[^/]+/[^/]+$" },
            "formulaName": { "type": "string", "minLength": 1 }
          }
        },
        "winget": {
          "type": "object",
          "required": ["packageIdentifier"],
          "additionalProperties": false,
          "properties": {
            "packageIdentifier": { "type": "string", "minLength": 1 }
          }
        }
      }
    },
    "templateVersion": {
      "type": "string",
      "pattern": "^\\d+\\.\\d+\\.\\d+$"
    }
    ,"ownership": {
      "type": "object",
      "required": ["roots"],
      "additionalProperties": false,
      "properties": {
        "roots": {
          "type": "array",
          "minItems": 1,
          "uniqueItems": true,
          "items": { "type": "string", "pattern": "^(?:\\.|(?!.*\\.\\.)(?!.*\\\\)(?!.*\\s)[A-Za-z0-9][A-Za-z0-9._/-]*)$" }
        }
      }
    }
    ,"defaultBranch": {
      "type": "string",
      "default": "main",
      "pattern": "^[A-Za-z0-9][A-Za-z0-9._-]{0,99}$",
      "description": "Branch the ci, qualification and package-smoke push triggers and the rust-hybrid release-candidate admission use. Default main."
    }
    ,"checkout": {
      "type": "object",
      "additionalProperties": false,
      "description": "Opt-in options for every actions/checkout step. longPaths renders a Windows-only step before each checkout running `git config --system core.longpaths true` (fixes 'Filename too long' on windows runners). sparse renders `sparse-checkout` (cone mode) with these directories into each checkout of the repository itself. Unset renders nothing.",
      "properties": {
        "longPaths": { "type": "boolean" },
        "sparse": {
          "type": "array",
          "minItems": 1,
          "maxItems": 64,
          "uniqueItems": true,
          "items": { "type": "string", "pattern": "^(?!.*\\.\\.)(?!\\.?/)[A-Za-z0-9._][A-Za-z0-9._/-]*$" }
        }
      }
    }
    ,"swift": {
      "type": "object",
      "additionalProperties": false,
      "anyOf": [{ "required": ["privatePackages"] }, { "required": ["check"] }],
      "description": "Opt-in read access to private Swift package mirrors. Renders a configure step before the first build or test step and an always-run cleanup step after the last one, in the ci job, the qualification job, the release-candidate candidate job, the regenerate job and the parallel dev-artifact-mac job. Needs at least one of the lanes ci, qualification, release-candidate, regenerate or swift-check. swift.check configures native iOS XCTest in the swift-check lane. Unset renders nothing.",
      "properties": {
        "check": {
          "type": "object",
          "additionalProperties": false,
          "required": [
            "runner",
            "xcodeVersion",
            "projectDirectory",
            "spec",
            "project",
            "scheme",
            "xcodegenVersion"
          ],
          "properties": {
            "runner": {
              "enum": [
                "macos-15",
                "macos-15-intel",
                "macos-26"
              ]
            },
            "xcodeVersion": {
              "type": "string",
              "pattern": "^\\d+\\.\\d+(?:\\.\\d+)?$"
            },
            "xcodegenVersion": {
              "type": "string",
              "pattern": "^\\d+\\.\\d+\\.\\d+$"
            },
            "projectDirectory": {
              "type": "string",
              "pattern": "^(?:\\.|(?!.*\\.\\.)(?!.*\\s)[A-Za-z0-9][A-Za-z0-9._/-]*)$"
            },
            "spec": {
              "type": "string",
              "pattern": "^(?!.*\\.\\.)(?!.*\\s)[A-Za-z0-9][A-Za-z0-9._/-]*\\.ya?ml$"
            },
            "project": {
              "type": "string",
              "pattern": "^(?!.*\\.\\.)(?!.*\\s)[A-Za-z0-9][A-Za-z0-9._/-]*\\.xcodeproj$"
            },
            "scheme": {
              "type": "string",
              "pattern": "^[A-Za-z0-9][A-Za-z0-9._-]*$"
            }
          }
        },
        "privatePackages": {
          "type": "array",
          "minItems": 1,
          "maxItems": 4,
          "items": {
            "type": "object",
            "required": ["host", "secret"],
            "additionalProperties": false,
            "properties": {
              "host": { "type": "string", "pattern": "^[A-Za-z0-9](?:[A-Za-z0-9-]{0,62})(?:\\.[A-Za-z0-9](?:[A-Za-z0-9-]{0,62}))*$", "description": "Bare host name, for example github.com. Unique within the list." },
              "secret": { "type": "string", "pattern": "^(?![Gg][Ii][Tt][Hh][Uu][Bb]_)[A-Za-z_][A-Za-z0-9_]{0,99}$", "description": "GitHub Actions secret name holding a fine-grained token with contents:read on the mirror. Provisioned by the repository owner." }
            }
          }
        }
      }
    }
    ,"profile": { "enum": ["node", "rust-hybrid"] },
    "rustCache": {
      "type": "object",
      "required": ["workspaces"],
      "additionalProperties": false,
      "properties": {
        "workspaces": {
          "type": "array",
          "minItems": 1,
          "uniqueItems": true,
          "items": { "type": "string", "pattern": "^(?:\\.|(?!.*\\.\\.)(?!.*\\s)[A-Za-z0-9][A-Za-z0-9._/-]*)$" }
        },
        "requiredForGate": { "type": "boolean" },
        "keySuffix": {
          "type": "string",
          "pattern": "^[A-Za-z0-9][A-Za-z0-9._-]{0,63}$",
          "description": "Appended to the Swatinem/rust-cache key as <lane>-<keySuffix>. rust-cache never re-saves on an exact key hit; change the suffix to rotate the cache."
        }
      }
    },
    "gate": {
      "type": "object", "required": ["path"], "additionalProperties": false,
      "properties": { "path": { "type": "string", "pattern": "^(?!.*\\.\\.)(?!.*\\s)[A-Za-z0-9][A-Za-z0-9._/-]*$" } }
    },
    "qaEvidencePath": {
      "type": "string",
      "description": "rust-hybrid only. Safe relative path under $RUNNER_TEMP where the gate writes QA evidence; rendered as ${{ runner.temp }}/<path> and uploaded with if: always().",
      "pattern": "^(?!.*\\.\\.)(?!.*\\s)[A-Za-z0-9][A-Za-z0-9._/-]*$"
    },
    "qaEvidenceRetentionDays": {
      "type": "integer",
      "minimum": 1,
      "maximum": 90,
      "default": 7,
      "description": "rust-hybrid only, requires qaEvidencePath. Artifact retention in days."
    },
    "ciAllOs": {
      "type": "boolean",
      "default": false,
      "description": "rust-hybrid only. When true, the ci job runs the gate on every matrix.os runner in declared order (fail-fast: false). When false or unset, the ci job uses one runner (preferring the first windows-* entry, else the first matrix.os entry)."
    },
    "ciIncremental": {
      "type": "boolean",
      "default": false,
      "description": "rust-hybrid only. When true, the ci job uses Swatinem/rust-cache with cache-workspace-crates, CARGO_INCREMENTAL=1, and caches Xcode DerivedData on macOS legs."
    },
    "regenerate": {
      "type": "object",
      "description": "Manual-only lane: runs `script`, checks the result, and opens a pull request from a right-git/regenerate-<run> branch. Requires lane 'regenerate'. Never writes to the default branch.",
      "required": ["script"],
      "additionalProperties": false,
      "properties": {
        "script": { "type": "string", "pattern": "^[A-Za-z0-9][A-Za-z0-9:_-]*$" }
      }
    },
    "signExisting": {
      "type": "object",
      "description": "rust-hybrid only. Manual-only lane 'sign-existing': verifies an already-qualified artifact of another run of this repository (run id, artifact id or name, source sha) through the GitHub API and signs it per file with right-release sign-dev-artifact in the protected signing environment. Never builds. Requires lane 'sign-existing' and a macOS runner in matrix.os.",
      "required": ["macSignManifest", "macPayloadMetadata"],
      "additionalProperties": false,
      "properties": {
        "macSignManifest": { "type": "string", "pattern": "^(?!.*\\.\\.)(?!.*\\s)[A-Za-z0-9][A-Za-z0-9._/-]*$", "description": "Repository-relative sign manifest JSON (per-file fixed codesign identifiers, paths relative to the extracted artifact)." },
        "macPayloadMetadata": { "type": "string", "pattern": "^(?!.*\\.\\.)[A-Za-z0-9][A-Za-z0-9._/ -]*$", "description": "Payload metadata JSON inside the artifact, relative to the extracted artifact root." },
        "macPayloadMetadataSource": { "type": "string", "pattern": "^(?!.*\\.\\.)(?!.*\\s)[A-Za-z0-9][A-Za-z0-9._/-]*$", "description": "Optional repository-relative path of a generated payload metadata file (for example dist/dev-macos/payload.json). When set, the unsigned dev packaging step zips the .app (wrapper layout kept) plus this file at the inner-zip root, named by macPayloadMetadata (a bare file name); the step fails if the file is missing. Needs devArtifact.mac 'sign', 'notarize' or 'unsigned'." },
        "environment": { "type": "string", "pattern": "^[A-Za-z0-9][A-Za-z0-9._-]{0,99}$", "description": "Protected GitHub environment holding the Developer ID secrets. Defaults to the candidate.releaseChain signing environment, else 'release'." }
      }
    },
    "concurrency": {
      "type": "object",
      "additionalProperties": false,
      "description": "Requires lane 'ci'. Sets the ci workflow's concurrency: one CI run in progress per repository unless mainPushes is 'queue' with a recorded reason.",
      "properties": {
        "mainPushes": {
          "enum": ["cancel", "queue"],
          "default": "cancel",
          "description": "'cancel' (default) renders the supersede job: a newer push to the default branch cancels an older run that only just started or is failing, and waits for one that is nearly done. 'queue' lets default-branch pushes run to completion, renders no supersede job and requires 'reason'; PR runs still cancel superseded runs."
        },
        "graceFraction": {
          "type": "number",
          "exclusiveMinimum": 0,
          "maximum": 1,
          "default": 0.7,
          "description": "Not with mainPushes 'queue'. An older default-branch run is cancelled by a newer push while its elapsed time is under this fraction of the median duration of the last medianWindow successful runs (or when any of its jobs has failed). Past it, the run is left to finish and the new run waits."
        },
        "medianWindow": {
          "type": "integer",
          "minimum": 1,
          "maximum": 100,
          "default": 10,
          "description": "Not with mainPushes 'queue'. How many recent successful push runs of the workflow the median duration is taken over. With fewer than 3 such runs nothing is cancelled for being young; only runs that never started and runs with a failed job are."
        },
        "reason": {
          "type": "string",
          "minLength": 1,
          "pattern": "^(?=.*\\S)[^\\r\\n\\u0085\\u2028\\u2029]+$",
          "description": "Required, non-empty, single line, when mainPushes is 'queue': why default-branch pushes must not cancel each other. Rendered as a YAML comment above the ci workflow's concurrency block."
        }
      },
      "if": { "properties": { "mainPushes": { "const": "queue" } }, "required": ["mainPushes"] },
      "then": { "required": ["reason"] },
      "else": { "not": { "required": ["reason"] } }
    },
    "devArtifact": {
      "type": "object",
      "additionalProperties": false,
      "description": "rust-hybrid only. Dev builds on push to the default branch (never PRs). mac 'sign' Developer ID-signs (no notarization) in a separate job using the release environment; windows 'unsigned' uploads built files as-is.",
      "properties": {
        "mac": { "enum": ["sign", "notarize", "unsigned", "none"] },
        "windows": { "enum": ["unsigned", "none"] },
        "parallel": { "type": "boolean", "default": false, "description": "When true, each platform builds and stages the dev app in its own dev-artifact-<platform> job beside the QA gate job, instead of after the gate in the ci job. Requires buildScript." },
        "buildScript": { "type": "string", "pattern": "^[A-Za-z0-9][A-Za-z0-9:_-]*$", "description": "Package script that compiles the dev app. Required when parallel is true; rejected otherwise." },
        "retentionDays": { "type": "integer", "minimum": 1, "maximum": 90, "default": 7 },
        "macAppPath": { "type": "string", "pattern": "^(?!.*\\.\\.)[A-Za-z0-9][A-Za-z0-9._/ -]*\\.app$", "description": "Repository-relative path of the built .app (required when mac is 'sign')." },
        "macEntitlements": { "type": "string", "pattern": "^(?!.*\\.\\.)(?!.*\\s)[A-Za-z0-9][A-Za-z0-9._/-]*$", "description": "Optional repository-relative entitlements plist for codesign." },
        "macSignManifest": { "type": "string", "pattern": "^(?!.*\\.\\.)(?!.*\\s)[A-Za-z0-9][A-Za-z0-9._/-]*$", "description": "Optional repository-relative sign manifest JSON (right-release sign-dev-artifact: per-file fixed codesign identifier, paths relative to the extracted archive). With mac 'sign', replaces codesign --deep on the .app. Requires macPayloadMetadata; not combinable with macEntitlements or mac 'notarize'." },
        "macPayloadMetadata": { "type": "string", "pattern": "^(?!.*\\.\\.)[A-Za-z0-9][A-Za-z0-9._/ -]*$", "description": "Path of the payload metadata JSON (recorded hashes) inside the staged archive, relative to the extracted archive root. Required with macSignManifest." },
        "windowsGlob": { "type": "string", "pattern": "^(?!.*\\.\\.)[A-Za-z0-9][A-Za-z0-9._/*?-]*$", "description": "Repository-relative glob of built files to upload (required when windows is 'unsigned')." }
      }
    },
    "candidate": {
      "type": "object",
      "required": ["buildScript", "checkScript", "admissionScript", "stageSummaryScript", "artifactRoot", "os"],
      "additionalProperties": false,
      "properties": {
        "buildScript": { "type": "string", "pattern": "^[A-Za-z0-9][A-Za-z0-9:_-]*$" },
        "checkScript": { "type": "string", "pattern": "^[A-Za-z0-9][A-Za-z0-9:_-]*$" },
        "admissionScript": {
          "type": "string",
          "pattern": "^[A-Za-z0-9][A-Za-z0-9:_-]*$",
          "description": "Runs in the unconditional `admission` job (workflow_dispatch envelope validation). Required for every release-candidate lane, signed or not."
        },
        "stageSummaryScript": {
          "type": "string",
          "pattern": "^[A-Za-z0-9][A-Za-z0-9:_-]*$",
          "description": "Runs (init/finalize) in the `candidate` job and, when configured, the windows-sign/macos-sign jobs. Required for every release-candidate lane, signed or not."
        },
        "artifactRoot": { "type": "string", "pattern": "^(?!.*\\.\\.)(?!.*\\s)[A-Za-z0-9][A-Za-z0-9._/-]*$" },
        "os": { "type": "array", "minItems": 1, "items": { "type": "string", "minLength": 1 } },
        "targets": {
          "type": "array",
          "minItems": 1,
          "items": {
            "type": "object",
            "required": ["os", "platform", "architecture"],
            "additionalProperties": false,
            "properties": {
              "os": { "type": "string", "minLength": 1 },
              "platform": { "enum": ["windows", "macos", "linux"] },
              "architecture": { "enum": ["x86_64", "arm64"] }
            }
          }
        },
        "devQualification": {
          "type": "object",
          "required": ["buildScript", "journeyScript"],
          "additionalProperties": false,
          "description": "Optional `dev-qualification` job (Orthic-Labs/rightkit#107): builds the dev build (QA surface on) from the admitted revision and runs the app's in-app journeys against it. Gates windows-sign and macos-sign. The sealed candidate stays QA-free. Unset renders nothing.",
          "properties": {
            "buildScript": { "type": "string", "pattern": "^[A-Za-z0-9][A-Za-z0-9:_-]*$", "description": "Package script that builds the dev build. Must differ from candidate.buildScript." },
            "journeyScript": { "type": "string", "pattern": "^[A-Za-z0-9][A-Za-z0-9:_-]*$", "description": "Package script that runs the in-app journeys against the dev build." }
          }
        },
        "signWindows": { "type": "boolean" },
        "signMacos": { "type": "boolean" },
        "releaseChain": {
          "type": "object",
          "required": ["evidenceVerificationScript", "windowsFinalizeScript", "installedQualificationScript", "publishScript", "qualificationRunnerVariable"],
          "additionalProperties": false,
          "properties": {
            "evidenceVerificationScript": {
              "type": "string",
              "pattern": "^[A-Za-z0-9][A-Za-z0-9:_-]*$",
              "description": "Runs in the `publish` job before the publish step, verifying the aggregated same-run signed/qualification evidence."
            },
            "windowsFinalizeScript": { "type": "string", "pattern": "^[A-Za-z0-9][A-Za-z0-9:_-]*$" },
            "macosFinalizeScript": { "type": "string", "pattern": "^[A-Za-z0-9][A-Za-z0-9:_-]*$" },
            "installedQualificationScript": { "type": "string", "pattern": "^[A-Za-z0-9][A-Za-z0-9:_-]*$" },
            "publishScript": { "type": "string", "pattern": "^[A-Za-z0-9][A-Za-z0-9:_-]*$" },
            "qualificationRunnerVariable": { "type": "string", "pattern": "^[A-Z][A-Z0-9_]*$" },
            "publishSecrets": {
              "type": "array",
              "uniqueItems": true,
              "items": { "type": "string", "pattern": "^[A-Z][A-Z0-9_]*$" }
            }
          }
        }
      }
    }
  }
}
